{
 "id": "int_dyrehuset",
 "building": "dyrehuset",
 "size": "L",
 "cols": 9,
 "rows": 7,
 "wall_style": "plank",
 "floor": "floor_plank",
 "door": {"cell": [4, 6], "dir": [0, 1]},
 "spawn_cell": [4, 5],
 "windows": {"z": [1, 6], "x": [1, 4]},
 "exit": {"area": "hyggebyen", "spawn": "from_int_dyrehuset"},
 "zoom_fit": 0.689,
 "items": [
  {"id": "counter_pine", "cell": [3, 2], "rot": 0, "role": "counter"},
  {"id": "hay_bale", "cell": [0, 0], "rot": 0},
  {"id": "feed_sack_stack", "cell": [1, 0], "rot": 0},
  {"id": "feed_sack_stack", "cell": [2, 0], "rot": 0},
  {"id": "shelf_pine", "cell": [0, 0], "rot": 0},
  {"id": "shelf_birch", "cell": [0, 0], "rot": 0},
  {"id": "table_dining_oak", "cell": [0, 3], "rot": 0},
  {"id": "feed_sack_stack", "cell": [8, 3], "rot": 0},
  {"id": "plant_fern", "cell": [0, 4], "rot": 0},
  {"id": "chest_pine", "cell": [8, 4], "rot": 0},
  {"id": "floor_lamp_birch", "cell": [0, 5], "rot": 0}
 ],
 "posts": [
  {"id": "counter", "cell": [4, 1], "act": "work", "facing": "S", "capacity": 1, "kind": "keeper"},
  {"id": "cust1", "cell": [1, 4], "act": "stand", "facing": "N", "capacity": 1, "kind": "customer"},
  {"id": "cust2", "cell": [7, 3], "act": "stand", "facing": "N", "capacity": 1, "kind": "customer"},
  {"id": "cust3", "cell": [6, 4], "act": "stand", "facing": "N", "capacity": 1, "kind": "customer"}
 ],
 "markers": [
  {"type": "hatch", "cells": [[0, 2], [1, 2], [2, 2], [6, 2], [7, 2], [8, 2]]},
  {"type": "shop", "id": "animal_store", "keeper": "farmer_rosa", "cell": [4, 3]},
  {"type": "talk", "keeper": "farmer_rosa", "cell": [3, 3]},
  {"type": "talk", "keeper": "farmer_rosa", "cell": [5, 3]},
  {"type": "door", "cell": [4, 6], "to": "hyggebyen", "spawn": "from_int_dyrehuset"}
 ],
 "notes": []
}
